{
  "meta" : {
    "schema_version" : "1.0.0"
  },
  "name" : "Componente de Persistence y Web",
  "viability" : "Media",
  "score" : 0.5458165064102564,
  "metrics" : {
    "cohesion_adjusted" : 0.6156330128205127,
    "external_coupling" : 0.32,
    "data_cohesion" : 0.0,
    "internal_edge_density" : 0.10897435897435898,
    "size" : 13,
    "cluster_count" : 2
  },
  "components" : [ "banco_hexagonal.pruebatecnica.application.Port.In.ClientUseCase", "banco_hexagonal.pruebatecnica.application.Port.In.MovementUseCase", "banco_hexagonal.pruebatecnica.application.service.ClientService", "banco_hexagonal.pruebatecnica.application.service.MovementService", "banco_hexagonal.pruebatecnica.domain.Model.Client", "banco_hexagonal.pruebatecnica.domain.Model.Movement", "banco_hexagonal.pruebatecnica.infraestructure.Adapter.DTOs.ClientResponseDTO", "banco_hexagonal.pruebatecnica.infraestructure.Adapter.DTOs.MovementResponseDTO", "banco_hexagonal.pruebatecnica.infraestructure.Adapter.Mapper.MovementMapper", "banco_hexagonal.pruebatecnica.infraestructure.Adapter.Persistence.ClientRepositoryJpa", "banco_hexagonal.pruebatecnica.infraestructure.Adapter.Persistence.MovementRepositoryJpa", "banco_hexagonal.pruebatecnica.infraestructure.Adapter.Web.ClientController", "banco_hexagonal.pruebatecnica.infraestructure.Adapter.Web.MovementController" ],
  "clusters" : [ 1, 2 ],
  "rationale" : [ "📊 Métricas de Calidad: CBO promedio 2,1 (acoplamiento entre objetos), LCOM promedio 0,13 (cohesión de métodos: 0=alta, 1=baja)", "⚠️ Cohesión moderada (62%) - componentes parcialmente relacionados; considerar refactorización para agrupar responsabilidades más claramente", "⚠️ Acoplamiento moderado (32%) - algunas dependencias externas; considerar aplicar patrones como facades o abstracciones para reducir acoplamiento", "✅ CBO bajo (2,1) - acoplamiento entre clases controlado, fácil de mantener", "✅ LCOM bajo (0,13) - alta cohesión de métodos, clases con responsabilidad única bien definida", "✅ Tamaño adecuado (13 componentes) - módulo de tamaño manejable" ],
  "recommended_actions" : [ "🔧 Refactorizar para mejorar cohesión y reducir acoplamiento", "🔧 Aplicar principios SOLID (SRP, DIP) para separación de responsabilidades", "🔧 Considerar eventos asíncronos para reducir acoplamiento síncrono", "📋 Re-evaluar después de refactorización" ]
}